{"role":"verifier","scope":{"kind":"unit","id":"u1-release-metadata"},"release":"2.1.47","rows":[{"slug":"spec-release","type":"database-table","level":1,"status":"covered","evidence":"058 + baseline columns; spec-release-accepted-shadow.migration.test.ts:34,:61"},{"slug":"release","type":"dto","level":1,"status":"covered","evidence":"entities.ts AcceptedShadow; releases.accepted-shadow.test.ts:95,:118,:132"},{"slug":"ac-post-api-releases-nie-ustawia-accepte","type":"ac","level":2,"status":"covered","evidence":"releases.accepted-shadow.test.ts:77"},{"slug":"goal:u1-release-metadata","level":2,"status":"covered","evidence":"release-accepted-shadow.test.ts:91-173"},{"slug":"release-tools-release-create","level":2,"status":"covered","evidence":"mcpRelease projection; index.test.ts:636"},{"slug":"release-tools-release-list","level":2,"status":"covered","evidence":"index.test.ts:688"},{"slug":"release-tools-release-update","level":2,"status":"covered","evidence":"index.test.ts:835"}],"suite":{"command":"npm run typecheck (static)","exitCode":0,"summary":"typecheck 0 errors; touched/adjacent tests read, none broken"}}
