{
 "role": "verifier",
 "scope": {
  "kind": "unit",
  "id": "u03-editor-command-sources"
 },
 "release": "2.1.9",
 "rows": [
  {
   "slug": "editor-context-spec",
   "type": "code-snippet",
   "level": 1,
   "status": "covered",
   "evidence": "trace.md:14; src/client/tiptap/contextSpec.ts:84-88 slashCommands doc = SlashCommand.id AND command-source ids; registry.ts:521-524 page view adds sources; src/client/tiptap/slashSources.test.ts:158 expect(page.slashCommands).toEqual(expect.arrayContaining(['section','mention','test-src:spec'])) + keys unchanged"
  },
  {
   "slug": "wklad-do-edytora-m05#adnotacje page-bound",
   "type": "code-snippet",
   "level": 1,
   "status": "covered",
   "evidence": "trace.md:15; src/client/tiptap/slashSources.test.ts:310 expect(getEditorExtensionRegistration('annotationHighlight')?.markdownIt).toBeUndefined(); decorations page/plan contain 'annotations', chat-input []"
  },
  {
   "slug": "wklad-do-edytora-m05#`chat-input`",
   "type": "code-snippet",
   "level": 1,
   "status": "covered",
   "evidence": "trace.md:16; contextSpec.ts:230-236 chat-input extensions incl. slash_commands, save explicit; ChatInputEditor.tsx:81-92 builds from context; src/client/tiptap/slashSources.test.ts:322 expect(spec.extensions).toEqual(arrayContaining(['slash_commands','mention_extension','page_ref','section_ref'])), save explicit"
  },
  {
   "slug": "wklad-do-edytora-m20#węzeł znacznika inline",
   "type": "code-snippet",
   "level": 1,
   "status": "covered",
   "evidence": "trace.md:17; xmlNodes.ts:118 rule xml_inline, :181 group inline; src/client/tiptap/slashSources.test.ts:232"
  },
  {
   "slug": "wklad-do-edytora-m20#węzeł znacznika blokowy",
   "type": "code-snippet",
   "level": 1,
   "status": "covered",
   "evidence": "trace.md:18; xmlNodes.ts:52 xml_block; src/client/tiptap/slashSources.test.ts:244 expect(node.config.group).toBe('block')"
  },
  {
   "slug": "wklad-do-edytora-m20#surowy węzeł kodu JSX",
   "type": "code-snippet",
   "level": 1,
   "status": "covered",
   "evidence": "trace.md:19; registrations.ts:143-156; src/client/tiptap/slashSources.test.ts:256 markdownIt.kind 'block_content', mounted in all 5 contexts"
  },
  {
   "slug": "wklad-do-edytora-m20#listy zadań GFM",
   "type": "code-snippet",
   "level": 1,
   "status": "covered",
   "evidence": "trace.md:20; src/client/tiptap/slashSources.test.ts:268 taskList/taskItem mounted in page/plan/description, not chat-input"
  },
  {
   "slug": "wklad-do-edytora-m20#`MentionExtension`",
   "type": "code-snippet",
   "level": 1,
   "status": "covered",
   "evidence": "trace.md:21; src/client/tiptap/slashSources.test.ts:282 expect(reg?.priority).toBe(1100); trigger '@' source 'files'"
  },
  {
   "slug": "wklad-do-edytora-m20#`OutlineExtension`",
   "type": "code-snippet",
   "level": 1,
   "status": "covered",
   "evidence": "trace.md:22; src/client/tiptap/slashSources.test.ts:290 heading_actions registered, no parser rule, mounted page/plan"
  },
  {
   "slug": "wklad-do-edytora-m20#`SlashDispatcher`",
   "type": "code-snippet",
   "level": 1,
   "status": "covered",
   "evidence": "trace.md:23; SlashCommands.ts:285-340 char '/', items from createSlashSession (slashPalette.ts:102); src/client/tiptap/slashSources.test.ts:298 rows contain command section AND source test-src:dispatch"
  },
  {
   "slug": "ac-chat-input-minimalna-instancja-tiptap",
   "type": "ac",
   "level": 2,
   "status": "covered",
   "evidence": "src/client/tiptap/slashSources.test.ts:169 expect(mounted).toEqual(arrayContaining(['slash_commands','mention_extension','page_ref','section_ref'])); EditorFactory.ts:51-55 + contextSpec.ts chat-input spec"
  },
  {
   "slug": "m14-composer-pageref-serializacja-at",
   "type": "ac",
   "level": 2,
   "status": "covered",
   "evidence": "src/client/tiptap/slashSources.test.ts:190 for at/backticks/link: toBe('@modules/m01.md'); registrations.ts:163-165 chat-input configures PageRefNode serializeAs 'at'; PageRefNode.ts:190-195 forced syntax; ChatInputEditor.tsx:161-163 submit via storage.markdown.getMarkdown"
  },
  {
   "slug": "m20-composer-slash-popover",
   "type": "ac",
   "level": 2,
   "status": "covered",
   "evidence": "src/client/tiptap/slashSources.test.ts:180 slash_commands mounted in chat-input with options.contextId 'chat-input'; expect(rows.map(r=>r.label)).toContain('/section')"
  },
  {
   "slug": "m20-zrodlo-komend-blad-odczytu",
   "type": "ac",
   "level": 2,
   "status": "covered",
   "evidence": "src/client/tiptap/slashSources.test.ts:121 throwing + rejecting sources; expect(keys).toContain('command:mention'|'section'|'todo') and other source item present; slashPalette.ts:122-130 readSource catch → []"
  },
  {
   "slug": "m20-zrodlo-komend-kolizja-hint",
   "type": "ac",
   "level": 2,
   "status": "covered",
   "evidence": "src/client/tiptap/slashSources.test.ts:105 expect(keys).toContain('command:section'); expect(keys).not.toContain('source:test-src:clash:sec'); slashPalette.ts:132-143 (fixed trigger = label, recorded ASSUMPTION dev-0302)"
  },
  {
   "slug": "m20-zrodlo-komend-poza-whitelista",
   "type": "ac",
   "level": 2,
   "status": "covered",
   "evidence": "src/client/tiptap/slashSources.test.ts:93 expect(rows.some(r=>r.source)).toBe(false); expect(list).not.toHaveBeenCalled(); registry.ts:614-620 filter by spec.slashCommands"
  },
  {
   "slug": "m20-zrodlo-komend-pull-przy-otwarciu",
   "type": "ac",
   "level": 2,
   "status": "covered",
   "evidence": "src/client/tiptap/slashSources.test.ts:75 second session keys arrayContaining alpha+beta, list called 2x; SlashCommands.ts onExit session=null (new session per opening)"
  },
  {
   "slug": "m05-znacznik-slug-bez-type-bez-renderu",
   "type": "ac",
   "level": 2,
   "status": "covered",
   "evidence": "src/client/chat/xml-chip-preprocess.test.ts:30 expect(isChipTag('scratch_slug_only')).toBe(false); expect(preprocessXmlChips(text)).toBe(text); xml-chip-preprocess.ts:47-53 chipTargetOf requires type+slug"
  },
  {
   "slug": "goal:u03-editor-command-sources",
   "level": 2,
   "status": "covered",
   "evidence": "sources: registry.ts:594-620 (direct registration, whitelist by id), slashPalette.ts (pull per opening, hint filter, collision, read failure, narrowing), SlashCommands.ts:298-313 narrow same popover + clear prefix, SlashMenu.tsx:121-129 origin marker; composer: contextSpec.ts chat-input slash_commands + /section; @/PageRefNode gate: contextSpec.ts:57 pageLinks = kind==='pages', ROOT_PROP_GATES mention_extension/page_ref, buildMarkdownIt.ts:476 no @ rule when page_ref unmounted; chat: XmlChipDispatcher getTagRender first, xml-chip-preprocess.ts rendersInChat step 0, slug w/o type stays text. Removal m14 km8w7ab1/M05 'zero slash framework': no code/test asserts it. Deferred spec-skills/skill_ref: not built (comment only, contextSpec.ts:197)"
  }
 ],
 "suite": {
  "command": "npm run typecheck",
  "exitCode": 0,
  "summary": "tsc --noEmit across root + workspaces: exit 0; related tests read (contextSpec, buildMarkdownIt.context, slashCommands.context, xml-chip-preprocess, SlashCommands.narrow) consistent with the diff"
 }
}