{
  "role": "verifier",
  "scope": {
    "kind": "unit",
    "id": "u10-cli-and-turns"
  },
  "release": "2.1.26",
  "rows": [
    {
      "slug": "c4s-tools-ask",
      "level": 1,
      "status": "covered",
      "evidence": "src/server/mcp/c4s-tools.ts:47-129 (params verbatim per 2.1.26 record, effort z.enum(['low','medium','high']), no annotations, INVALID_ARGS on empty message/project before runAgent, workspace defaults to caller, AgentError code+hint else AGENT_ERROR); tests src/server/mcp/c4s-tools.test.ts:203,235 — expect(props.effort!.enum).toEqual(['low','medium','high']); hints undefined; expect(hoisted.calls[0]).toMatchObject({ workspace: 'ws-caller', contextType: 'ask', output: 'final' }); error envelope {code:'RESUME_CONFIG_LOCKED',hint} / {code:'AGENT_ERROR'}; required ['message','project'] at :220; INVALID_ARGS refusal at :160",
      "type": "mcp-tool"
    },
    {
      "slug": "ask",
      "level": 1,
      "status": "covered",
      "evidence": "src/server/operations/core-operations.ts:2149-2197 (workspace, agent-mediated, fullParity, sideEffects ['file','db'], contentInput 'n/a', idempotent false, 15 codes incl. RESUME_CONFIG_LOCKED, renderings {internal/mcp: ['c4s-tools.ask']}); CLI rendering src/bin/c4s/commands/ask.ts operation:'ask', dropped from NON_CATALOG_DELEGATING (registry.ts:145); test src/server/operations/catalog.test.ts:1530 expectOperationMatchesRecord(...) + expect(op.errorCodes).toHaveLength(15) + effort 'max' rejected",
      "type": "spec-operation"
    },
    {
      "slug": "abort-turn",
      "level": 1,
      "status": "covered",
      "evidence": "src/server/operations/core-operations.ts abort_turn row: project, direct, fullParity, ['db','ui-notify'], idempotent, codes ['THREAD_NOT_FOUND','VALIDATION'], threadId|requestId optional, no renderings (record narzedzia [] — non-blocking deviation dev-2612 sent); test src/server/operations/catalog.test.ts:1572 — expect([...op.errorCodes].sort()).toEqual(['THREAD_NOT_FOUND','VALIDATION']); expect(op.renderings ?? {}).toEqual({}); behaviour pre-existing in src/server/routes/chat.ts:324-390",
      "type": "spec-operation"
    },
    {
      "slug": "create-thread",
      "level": 1,
      "status": "covered",
      "evidence": "core-operations.ts create_thread row: human-mediated, internal/cli/mcp na('katalog wątków jest wewnętrzną sprawą interfejsu'), rest direct, ['db','ui-notify'], not idempotent, ['VALIDATION']; behaviour src/server/routes/threads.ts:43-59 (non chat/ask context_type → 400 VALIDATION); test catalog.test.ts:1596 expectOperationMatchesRecord(...)",
      "type": "spec-operation"
    },
    {
      "slug": "delete-thread",
      "level": 1,
      "status": "covered",
      "evidence": "core-operations.ts delete_thread row: human-mediated, rest-only, ['db','ui-notify'], idempotent, ['NOT_FOUND'], threadId required; test catalog.test.ts:1614 expectOperationMatchesRecord(...) + expect(optional('delete_thread','threadId')).toBe(false)",
      "type": "spec-operation"
    },
    {
      "slug": "list-threads",
      "level": 1,
      "status": "covered",
      "evidence": "core-operations.ts list_threads row: human-mediated, rest-only, ['none'], idempotent, errorCodes [] (record n/d), limit/offset; behaviour threads.ts:27-34 default 20, updated_at DESC; test catalog.test.ts:1632 expectOperationMatchesRecord(...) + expect(op.summary).toMatch(/20 rows/)",
      "type": "spec-operation"
    },
    {
      "slug": "run-turn",
      "level": 1,
      "status": "covered",
      "evidence": "core-operations.ts:2324-2381 run_turn: project, direct, internal via spawn_child_turn, cli/mcp/rest na with record powody verbatim (mcp no longer via runTransagent), ['file','db','ui-notify'], contentInput n/a, codes + NOT_FOUND, no renderings; tests catalog.test.ts:1650 expectOperationMatchesRecord(...) and :483 expect(row.channels.mcp.kind).toBe('na')",
      "type": "spec-operation"
    },
    {
      "slug": "spawn-child-turn",
      "level": 1,
      "status": "covered",
      "evidence": "core-operations.ts:2405-2442 spawn_child_turn: agent-mediated, internal direct, cli/mcp/rest na with record powody verbatim, 8 codes, renderings {internal:['transagent-tools.runTransagent']}; test catalog.test.ts:1679 expectOperationMatchesRecord(... narzedzia: { internal: ['transagent-tools-runtransagent'] })",
      "type": "spec-operation"
    },
    {
      "slug": "section:ihakwlks",
      "level": 2,
      "status": "covered",
      "evidence": "src/bin/c4s/errors.ts: CliErrorCode has INDEX_STALE (:34), SEARCH_BUDGET_EXCEEDED (:120), AMBIGUOUS_SLUGS/ENTITY/PAGE removed with exits 20/21; cliErrorFromDiscovery passes core code+hint; no survivor in src/plugins/tests/skills (grep only comments/tests); tests src/bin/c4s/errors.test.ts:101 expect(mapped).toMatchObject({ code, message, hint }) for 7 core codes, :111 expect(union).not.toContain(gone); expect(codeToExit(gone)).toBe(1); @ts-expect-error new CliError('AMBIGUOUS_ENTITY')"
    },
    {
      "slug": "section:m11dcmds",
      "level": 2,
      "status": "covered",
      "evidence": "list-pages.ts errorCodes drop PAGE_NOT_FOUND; get-sections.ts adds PAGE_NOT_FOUND (item error); get-page/get-page-outline keep it; get-field-content.ts operation 'get_field_content' (cli direct via coreRead); AMBIGUOUS_SLUGS removed; tests src/bin/c4s/registry.test.ts:110 expect(c.errorCodes).toContain('PAGE_NOT_FOUND') x3 / expect(listPagesCommand.errorCodes).not.toContain('PAGE_NOT_FOUND'); :123 expect(getFieldContentCommand.operation).toBe('get_field_content') + validateCommandContributions → []"
    },
    {
      "slug": "section:m11dcore",
      "level": 2,
      "status": "covered",
      "evidence": "src/core/agent/http.ts:47 AgentErrorCode += RESUME_CONFIG_LOCKED; ask.ts errorCodes = SHARED_RESOLVER_CODES(4) + SERVER_DELEGATING_CODES(9) + INVALID_ARGS + RESUME_CONFIG_LOCKED = 15; test src/bin/c4s/errors.test.ts:157 expect([LOCAL.length, HTTP.length, LIFECYCLE.length]).toEqual([7, 6, 2]); expect([...declared].sort()).toEqual([...all].sort())"
    },
    {
      "slug": "section:g24dkd8t",
      "level": 2,
      "status": "covered",
      "evidence": "RESUME_CONFIG_LOCKED in CliErrorCode (errors.ts:20), agent.ts + ask.ts errorCodes, generic exit 1; runAgent readJson propagates 409 envelope code (http.ts:331-349); tests errors.test.ts:165 expect(agentCommand.errorCodes).toContain('RESUME_CONFIG_LOCKED'); expect(codeToExit('RESUME_CONFIG_LOCKED')).toBe(1); run-agent.test.ts:416 expect((err as AgentError).code).toBe('RESUME_CONFIG_LOCKED') with urls.at(-1) '/threads/T-old/ask'"
    },
    {
      "slug": "goal:u10-cli-and-turns",
      "level": 2,
      "status": "covered",
      "evidence": "15 turn-family codes: ask.ts errorCodes + core-operations ask row (15); INDEX_STALE/SEARCH_BUDGET_EXCEEDED mapped (errors.ts:34,120, cliErrorFromDiscovery); RESUME_CONFIG_LOCKED (errors.ts, http.ts, agent.ts, ask.ts); PAGE_NOT_FOUND on get-page/get-page-outline/get-sections not list-pages; get-field-content renders get_field_content; c4s-tools ask effort z.enum(low,medium,high); 7 turn/thread rows match records (catalog.test.ts:1530-1715); AMBIGUOUS_SLUGS/ENTITY/PAGE removed from CLI catalog with no alias (grep: only comments + negative tests)"
    }
  ],
  "suite": {
    "command": "npm run typecheck",
    "exitCode": 0,
    "summary": "tsc --noEmit across root and all plugin workspaces: 0 'error TS' lines; full vitest/e2e suite runs only in env-runner at system verification. No stubs provided by or pending on u10 in stubs.json; tests touching changed code (discovery-commands.test.ts ROOT_NOT_FOUND/PAGE_NOT_FOUND, catalog.test.ts content-input + profile invariants, patch-tools, c4s-tools) read through and still hold."
  }
}