{"role":"verifier","scope":{"kind":"unit","id":"m23-list-patches"},"release":"2.1.18","rows":[{"slug":"patch-page","type":"ui-view","level":1,"status":"covered","evidence":"PatchDetail.tsx:128-141 + PatchDetail.render.test.ts [entity:patch-page]; 'Historia wersji' unchanged in window (dev-0004)"},{"slug":"ac-list-patches-zwraca-patche-w-porzadku","type":"ac","level":2,"status":"covered","evidence":"transagent-tools.list-patches.test.ts; patch.ts comparePatchListOrder"},{"slug":"ac-list-patches-z-applied-false-zwraca-w","type":"ac","level":2,"status":"covered","evidence":"transagent-tools.list-patches.test.ts"},{"slug":"ac-list-patches-z-filtrem-brief-zwraca-w","type":"ac","level":2,"status":"covered","evidence":"transagent-tools.list-patches.test.ts"},{"slug":"ac-patch-legacy-ze-status-completed-i-be","type":"ac","level":2,"status":"covered","evidence":"transagent-tools.list-patches.test.ts"},{"slug":"ac-watek-patch-ktory-stwierdza-ze-patch","type":"ac","level":2,"status":"covered","evidence":"patch-tools.test.ts; interaction-rules.ts PATCH_RULES; golden updated"},{"slug":"ac-wywolanie-list-patches-w-watku-contex","type":"ac","level":2,"status":"covered","evidence":"agent-turn.test.ts non-registration (dev-0002)"},{"slug":"goal:m23-list-patches","level":2,"status":"covered","evidence":"transagent-tools.ts buildListPatchesTool; agent-turn.ts:1562-1567; M39 paginate listPatches=50 [section:m23brsv01]; no removals; stubs empty"}],"suite":{"command":"npm run typecheck","exitCode":0,"summary":"tsc --noEmit green; touched tests read statically"}}
