{"role":"verifier","scope":{"kind":"unit","id":"m21-brief-full-read-and-cli"},"release":"2.1.48","rows":[{"slug":"get-brief","type":"cli-command","level":1,"status":"covered","evidence":"src/bin/c4s/commands/get-brief.ts:57-62 delegateGet('/artifacts/brief/<enc>', { view: 'operation', ...(range !== undefined ? { range } : {}) }) — raw --range, local parseRange removed, no budget/cut; truncated + truncationHint passed through with toCliHint rewriting '?view=operation&range=a-b' -> 'c4s get-brief <path> --range a-b' (:111-124); registered/help in src/bin/c4s.ts:261. Test src/bin/c4s/commands/brief-patch-commands.test.ts:236 [entity:cli-command/get-brief]. Note: prints {frontmatter, body, content} (data minus path/hash), justified by active ac-c4s-read-brief-brief-path-zwraca (decisions.md)."},{"slug":"brief-page","type":"ui-view","level":1,"status":"covered","evidence":"src/client/lib/briefs-api.ts:109 get() reads /api/artifacts/brief/<path> (default projection, no view/range); BriefEditor autosave PUT {content, expectedHash}, 409 banner with single 'Reload'. Test src/client/components/BriefDetail.render.test.ts:226 [entity:brief-page] body > DEFAULT_BUDGET_CHARS; useCreateBriefThread no longer refetches the whole-file detail (useBriefs.ts:76-83). states: [] at window."},{"slug":"ac-brief-dluzszy-niz-budzet-odpowiedzi-w","type":"ac","level":2,"status":"covered","evidence":"src/client/components/BriefDetail.render.test.ts:280 — url without view=/range=; shown.length > DEFAULT_BUDGET_CHARS; last line toBe(LAST)"},{"slug":"ac-po-autozapisie-briefu-dluzszego-niz-b","type":"ac","level":2,"status":"covered","evidence":"src/client/components/BriefDetail.render.test.ts:295 — sent.content.length > DEFAULT_BUDGET_CHARS; server.file last line toBe(LAST); server.file toBe(FRONTMATTER + edited + BODY)"},{"slug":"ac-c4s-get-brief-dla-briefu-dluzszego-ni","type":"ac","level":2,"status":"covered","evidence":"src/bin/c4s/commands/brief-patch-commands.test.ts:296 — real detail route: truncated true; content not toContain(LAST); hint matches c4s get-brief big.md --range a-b and the retry is served untruncated with the exact window"},{"slug":"ac-c4s-get-brief-range-1-10-zwraca-wylac","type":"ac","level":2,"status":"covered","evidence":"src/bin/c4s/commands/brief-patch-commands.test.ts:325 — real route, 40-line brief, --range 1-10: lines equal file lines 1..10; line 11 absent; truncated undefined"},{"slug":"goal:m21-brief-full-read-and-cli","level":2,"status":"covered","evidence":"Brief page loads whole file from default projection (proven past budget); CLI delegates to ?view=operation, no budget/cut/window validation (parseRange and ':' spelling removed, no alias); truncated + runnable --range hint passed through. No stubs, no jobs, no deletions."}],"suite":{"command":"npm run typecheck","exitCode":0,"summary":"tsc --noEmit EXIT 0 (tests not run locally per build rules; affected tests read statically)"}}
