{
  "role": "verifier",
  "scope": { "kind": "unit", "id": "u04-entities-root" },
  "release": "2.1.8",
  "rows": [
    {
      "slug": "goal:u04-entities-root",
      "level": 2,
      "status": "covered",
      "evidence": "Kind declared: src/shared/root-kinds.ts:163-174 KIND_DECLARATIONS.entities = {source:'code', sidebar:'hidden', fileMap:[{tags.json,json,HEAD},{*/*.json,json,entity_version}], flags:{release:true,references:false,gitignore:false,agentDirectFs:false}, reactions:['m29-entity-indexer']}; fixed dir via systemRootDir(kind) -> '.claude4spec/entities' (root-kinds.ts:197-208, id = kind). M29 mounts nothing: project-context.ts:540 EntityStore takes rootRegistry.system('entities').dir, comment 'the `entities` source is mounted by the root-registry loop'; mount+bind in src/server/workspace/root-registry-runtime.ts (test root-registry-runtime.test.ts:314 asserts w.isMounted(entitiesSource) and binder.isBound('m29-entity-indexer', entitiesSource)); core-reactions.ts:157 only defines m29-entity-indexer/m29-release-cache. Removals: no `entitiesDir` in Config/shared/client (grep src/client src/shared empty); config.ts:960 keeps it only in LEGACY_DIR_KEYS for a log warning (unknown field, never read); no 'Entities directory' settings element; watcher relocation code gone (src/server/fs/watcher.ts, only shared globToRegExp). M18: TagsService persists through EntityStore rooted at registry.system('entities').dir (project-context.ts:1713; registry.ts:54 finds by kind); tests src/server/services/tags-entities-root.test.ts:36 (legacy entitiesDir 'ents' ignored, tags.json in .claude4spec/entities). Deferred m29-release-cache binding to `releases` not newly built (releases kind declaration unchanged since 693e82d)."
    },
    {
      "slug": "completes:u03-root-registry:entities-root-registration",
      "level": 2,
      "status": "covered",
      "evidence": "SYSTEM_ROOTS (src/shared/root-kinds.ts:200) registers {id:'entities', name:'Entities', dir:'.claude4spec/entities', kind:'entities', builtin:false}; RootRegistry.system('entities') looks up by kind (src/server/roots/registry.ts:54). Test src/server/roots/registry.test.ts 'the `entities` system root is a registry entry from code ... (M02 l13model0)': expect(renamed.system('entities')).toEqual({ id: 'entities', name: 'Entities', dir: '.claude4spec/entities', kind: 'entities', builtin: false }); mount+bind asserted in src/server/workspace/root-registry-runtime.test.ts:290-292,314-334 (sourceByRootId.has('entities'), no store; m29-entity-indexer bound on the entities source)."
    },
    {
      "slug": "regression",
      "level": 2,
      "status": "covered",
      "evidence": "npm run typecheck: exit 0 (all workspaces, tsc --noEmit clean). Tests changed since wave start 693e82d (registry.test.ts, release-unreleased-diff.test.ts, tags-entities-root.test.ts, root-registry-runtime.test.ts) read as passing against current code: withFlag('release') now ['pages','adr','entities'] matches the entities flag; release page track uses registry.pages() (project-context.ts:1036). tests/integration/architecture/root-kind-gating.test.ts (unchanged) compares shapes relatively and its source scan (ID_OR_DIR_GATE / LEGACY_DIR_KEY) finds no offending production code line (static grep empty). No stubs in stubs.json for this unit."
    }
  ],
  "suite": {
    "command": "npm run typecheck",
    "exitCode": 0,
    "summary": "> @inharness-ai/c4s-plugin-ac@0.2.80 typecheck\n> tsc --noEmit\n(exit 0)"
  }
}
