{"role":"verifier","scope":{"kind":"unit","id":"u1-m34-catalogue-behaviour"},"release":"2.1.33","rows":[{"slug":"dialog","type":"ui-kit-component","level":1,"status":"uncovered","evidence":"Code and tests match (Dialog.tsx scrim zIndex default 1200 number, tiers 420/560/760, one maxHeight calc(100vh - 48px); Dialog.render.test.ts:449-487 green by reading). Mismatch in the published types: src/plugin-types/ui.ts:241 `/** Exact panel width in px, overriding `size` for the width; the height is still closed by `size`. */` contradicts the 2.1.33 record (size = 'Tier szerokości' only; 'limit wysokości panelu jest jeden dla wszystkich tierów'; width 'nie dotyka kontraktu overflow') and the size comment two lines above it in the same interface. Stale prose also in Dialog.tsx:70-76 DIALOG_SIZE_TIERS doc ('maxHeight is the tier's height cap… read from the tier')."}],"suite":{"command":"npm run typecheck","exitCode":0,"summary":"no errors; 15/16 slugs + goal covered (full verdict in session)"}}
