{"role":"verifier","scope":{"kind":"unit","id":"m10-list-plans"},"release":"2.1.18","rows":[{"slug":"ac-list-plans-wywolane-w-watku-chat-top","type":"ac","level":2,"status":"covered","evidence":"transagent-tools.list-plans.test.ts; agent-turn.test.ts:2181"},{"slug":"ac-list-plans-zwraca-plany-w-porzadku-cr","type":"ac","level":2,"status":"covered","evidence":"transagent-tools.list-plans.test.ts; plan.ts comparePlanCreationOrder"},{"slug":"goal:m10-list-plans","level":2,"status":"covered","evidence":"buildListPlansTool; agent-turn.ts:1567; /plans REST unchanged; plan-tools no list; dev-0005"},{"slug":"section:ww4lujgo","level":2,"status":"covered","evidence":"list-plans.test [section:ww4lujgo]"},{"slug":"section:m10mcp00","level":2,"status":"covered","evidence":"list-plans.test [section:m10mcp00]"},{"slug":"section:3f5ej79s","level":2,"status":"covered","evidence":"agent-turn.test.ts:2181-2192"},{"slug":"section:iatop5pj","level":2,"status":"covered","evidence":"agent-turn.test.ts:2181"}],"suite":{"command":"npm run typecheck","exitCode":0,"summary":"tsc --noEmit green; sibling tests consistent"}}
