{
  "role": "verifier",
  "scope": { "kind": "unit", "id": "pkg-lvs-ac" },
  "release": "2.1.14",
  "rows": [
    {
      "slug": "ac-load-skill-file-layered-vertical-slic-18",
      "type": "ac",
      "level": 2,
      "status": "covered",
      "evidence": "tests/integration/architecture/brief-workflow-recipe-completeness.test.ts:46 reads workflows/brief-workflow.md via SkillRegistry (what load_skill_file serves); Step 1: expect(map).toMatch(/every active `ac` criterion and every entity[^.]*with `op` create or update in the window is on the map/), toMatch(/not only those a section changed in the window points at, or whose `verifies` targets an entity the window changed/), not.toContain('asked to return only the matching slugs'); matches brief-workflow.md:31"
    },
    {
      "slug": "ac-load-skill-file-layered-vertical-slic-19",
      "type": "ac",
      "level": 2,
      "status": "covered",
      "evidence": "brief-workflow-recipe-completeness.test.ts:59 Step 5 checklist item: expect(item).toMatch(/Every criterion and entity slug the window created or changed stands in the `Read:` line of exactly one unit/); matches brief-workflow.md:85 (only checklist line containing 'created or changed')"
    },
    {
      "slug": "ac-gdy-kryterium-albo-encji-z-okna-nie-p",
      "type": "ac",
      "level": 2,
      "status": "covered",
      "evidence": "brief-workflow-recipe-completeness.test.ts:68 Step 2 rule line '**A slug without a module still has a unit.**': toMatch(/neither module tags nor `verifies` assign/), toMatch(/goes to the unit whose recipe reads the section or the entity it is about/), toMatch(/when no unit reads it, to a unit of the last wave/); plus Step 1 keep-on-map and Step 5 re-check; matches brief-workflow.md Step 2 bullet"
    },
    {
      "slug": "goal:pkg-lvs-ac",
      "level": 2,
      "status": "covered",
      "evidence": "plugins/c4s-plugin-layered-vertical-slices/src/skills/layered-vertical-slices/workflows/brief-workflow.md (Step 1 map from the window, Step 2 slug-without-module rule, Step 5 exactly-one-unit checklist item; old 'only the matching slugs' narrowing removed); plugins/c4s-plugin-ac/src/entity/ac/system-prompt.ts narrativeBlock: 'Fill `verifies` only when the criterion's subject is a specific entity ...' / 'behaviour described in a module's prose leaves `verifies` empty' (English, no mNN/lNN tokens per non-blocking pkg-dev-0001); asserted in plugins/c4s-plugin-ac/test/manifest-shape.test.ts [section:fsu38c8q] [section:eoi2kf2k]; schema verifies stays optional"
    }
  ],
  "suite": {
    "command": "npm run typecheck (static verification; tests run only in env-runner)",
    "exitCode": 0,
    "summary": "typecheck exit 0, 0 'error TS'. Read-through: skill-contribution.test.ts (live-reader regex, include usage, file-patch), lvs-no-contract-copies.test.ts (error codes/literals), system-prompt.golden.test.ts (uses fixture narrativeBlocks, not the ac plugin) are not broken by the diff. stubs.json empty."
  }
}
