{
  "role": "verifier",
  "scope": { "kind": "unit", "id": "ui-kit-catalog" },
  "release": "2.1.20",
  "rows": [
    { "slug": "ac-dialog-grupa-overlay-create-jest-contr", "type": "ac", "level": 2, "status": "covered", "evidence": "src/client/host-ui-kit/overlay/Dialog.render.test.ts:48-124 — catalog entry toMatchObject({ group: 'overlay', stability: 'experimental', binding: 'presentational' }); scrim role=dialog fixed inset-0 only while open, panel style.background 'var(--c-card)' + 'var(--c-hair-strong)'; scrim/✕/Escape call onClose x3 while scrim stays until consumer flips open; Tab/Shift+Tab trap; fetchSpy not.toHaveBeenCalled. Matches Dialog.tsx:194-283" },
    { "slug": "ac-dialog-przyjmuje-width-number-doklad", "type": "ac", "level": 2, "status": "covered", "evidence": "src/client/host-ui-kit/overlay/Dialog.render.test.ts:128-160 — size 'lg'/'sm' + width 400 → style.width '400px'; no width → DIALOG_SIZE_TIERS.sm.width (420); with width, panel maxHeight === DIALOG_SIZE_TIERS[size].maxHeight === tier-only maxHeight for sm/md/lg; maxHeight prop is @ts-expect-error and ignored. Dialog.tsx:224-226 width ?? tier.width, maxHeight: tier.maxHeight" },
    { "slug": "ac-dialog-scrolluje-wewnetrznie-cialo-przy", "type": "ac", "level": 2, "status": "covered", "evidence": "src/client/host-ui-kit/overlay/Dialog.render.test.ts:164-198 — panel flex-col with maxHeight = tier cap; body overflowY 'auto', minHeight '0', flex-1; footer not inside body, body.nextElementSibling === footer === panel.lastElementChild, flexShrink '0', unchanged after body.scrollTop=400. Dialog.tsx:259-278" },
    { "slug": "ac-popover-grupa-overlay-feedback-m34-exp", "type": "ac", "level": 2, "status": "covered", "evidence": "src/client/host-ui-kit/overlay-feedback/Popover.render.test.ts:58-119 — entry { group: 'feedback', experimental, presentational }; renders only while open, position fixed, zIndex 'var(--z-popover)'; anchor mousedown ignored, outside mousedown + Escape → onClose x2 while still rendered; no fetch; kit source has no ui/events / openPopover( / UI_EVENTS while src/client/ui/Popover.tsx imports the kit Popover and owns UI_EVENTS" },
    { "slug": "ac-most-tokenow-c4s-plugin-runtime-ui-eksp", "type": "ac", "level": 2, "status": "covered", "evidence": "src/client/host-ui-kit/tokens.render.test.ts:88-132 — HOST_TOKEN_NAMES toEqual 21 colour + 12 typography (--font-*, --text-*, --weight-*) + 2 layering (--z-popover, --z-toast), length 35; exported from runtime/plugin-runtime-ui; every name declared in theme.css :root, colours also in .dark, typography/z not; readHostTokens values (#faf8f4, #c45a3b, 34px, 15.5px, 600, 1100, 1300, Lora/Inter/JetBrains Mono) match c4s-paper-terra at 2.1.20 (checked via release-diff). Manual-debt clause recorded in tokens.ts header" },
    { "slug": "ac-groupedentitylist-jest-importowalny-z", "type": "ac", "level": 2, "status": "covered", "evidence": "src/client/runtime/plugin-runtime-ui.test.ts:16-40 — PLUGIN_RUNTIME_UI_EXPORT_NAMES toContain 'GroupedEntityList', typeof function, UI_KIT_CATALOG entry { group: 'list', experimental, presentational }, renderToStaticMarkup contains 'Server A','tool-1','tool-2'; src/server/core/plugin-host/runtime-shims.test.ts:60-66 — shim contains 'export const GroupedEntityList = __m[\"GroupedEntityList\"];' (runtime-shims.ts:66-72 emits exactly this); published type src/plugin-types/ui.ts:138" },
    { "slug": "ac-groupedentitylist-rysuje-tekst-pomocn", "type": "ac", "level": 2, "status": "covered", "evidence": "src/client/host-ui-kit/tokens.render.test.ts:173-205 — rendered var() set toEqual ['--c-hair','--c-muted'], each in HOST_TOKEN_NAMES; h2 color 'var(--c-muted)' + border 'var(--c-hair)', empty-group helper color 'var(--c-muted)'; both resolve to hex in light and dark and differ. Fix in list/GroupedEntityList.tsx:103-111 (was undefined --c-text-muted/--c-border)" },
    { "slug": "ac-usehosttokens-zwraca-nowe-wartosci-ko", "type": "ac", "level": 2, "status": "covered", "evidence": "src/client/host-ui-kit/tokens.render.test.ts:136-161 — after toggling .dark on <html>: --c-bg '#1b1a17', --c-ink '#ece7dc', --c-accent '#e07a5c' (light '#faf8f4'/'#2a2722'), text-h1/z-toast unchanged, back to '#faf8f4' on light. useHostTokens.ts MutationObserver on class attribute" },
    { "slug": "goal:ui-kit-catalog", "level": 2, "status": "covered", "evidence": "registry.ts UI_KIT_CATALOG {name,group,stability,binding,l11Surfaces?} with groups core/list/actions/form/overlay/detail/feedback/pickers + STABLE_UI_KIT_COMPONENTS derived by filter; tokens.ts HOST_TOKEN_NAMES (35) + readHostTokens, useHostTokens.ts; GroupedEntityList in registry/index/plugin-types; useToast not a registry entry (index.ts exports beside catalog); DocEditor l11Surfaces ['EditorBridge','QueryClient']; DirectoryPickerModal moved to src/client/components/; Dialog maxHeight prop removed (Dialog.tsx, plugin-types/ui.ts:229-240); releaseId removed from VersionHistoryItem (VersionHistory.tsx:10-26, plugin-types/ui.ts:271-282); ToastViewportProps controlled contract. Deferred (useToast facade, stable-list equality test) not built, as required. Nit: plugin-types/ui.ts:276 releaseLabel doc still says 'shown per-row' while the page says group heading, not row label (comment only)" }
  ],
  "suite": {
    "command": "npm run typecheck",
    "exitCode": 0,
    "summary": "tsc server/client/types + typecheck:envelopes: 0 errors. Static read of affected tests (VersionHistory.test.ts updated for releaseId removal; one-implementation.test.ts, registry.test.ts, EntityVersionHistoryView tests, runtime-shims/plugin-runtime-ui parity, e2e entity-version-history) found nothing broken by the diff"
  }
}
