{
  "role": "verifier",
  "scope": {
    "kind": "unit",
    "id": "u02-host-ui-kit"
  },
  "release": "2.1.26",
  "rows": [
    {
      "slug": "ac-allowrestore-false-ukrywa-akcje-rest",
      "type": "ac",
      "level": 2,
      "status": "covered",
      "evidence": "src/client/host-ui-kit/detail/EntityVersionHistoryView.render.test.ts:198 `render({ allowRestore: false })` → `expect(buttons('Restore')).toEqual([])` with timeline rendered (`toContain('v2')`, Compare to > 0); :207 default → click Restore → `expect(calls[0]![0]).toEqual({ type: 'dto', slug: 'user-dto', version: 2 })` on mocked useRestoreVersion().mutate, onRestored only on the hook's onSuccess. Both halves asserted. host-ui-kit source unchanged since dc2d8769 (only registry.test.ts by u03); typecheck green."
    },
    {
      "slug": "ac-diffview-m34-experimental-renderuje-p",
      "type": "ac",
      "level": 2,
      "status": "covered",
      "evidence": "src/client/host-ui-kit/detail/DiffView.render.test.ts:52 injected hunks rendered with add/del tints and +/− markers; :67 before 'a\\nb' / after 'a\\nc' → `expect(panes.length).toBe(2)`, panes verbatim ['a','b'] / ['a','c'], `hasTint(ADD_TINT)).toBe(false)`, no +/− (computes nothing); :84 hunks win over pair; :91 mode does not apply to pair. Code unchanged since r1."
    },
    {
      "slug": "ac-diffview-z-pustym-propsem-hunks-renderuj",
      "type": "ac",
      "level": 2,
      "status": "covered",
      "evidence": "src/client/host-ui-kit/detail/DiffView.render.test.ts:99 `render({})` → `toContain('No differences')` and `querySelector('[role=\"alert\"]')).toBeNull()`; :105 `hunks: []` → EmptyState, no panes; :111 half a pair → EmptyState; :117 empty hunks with a pair → panes. Code unchanged since r1."
    },
    {
      "slug": "ac-w-widoku-entityversionhistoryview-wers",
      "type": "ac",
      "level": 2,
      "status": "covered",
      "evidence": "Render: src/client/host-ui-kit/detail/EntityVersionHistoryView.render.test.ts:254 `expect(groupIds()).toEqual(['version-group-__unreleased__','version-group-release:2.1.0','version-group-release:2.0.0'])`, Unreleased group `toContain('Unreleased')`/'v4', not 'v3'; release name once (group heading, no row pill); `not.toContain('(unreleased)')`; :280 showReleasePill={false} → 'Release 7'/'Release 5'. Code: VersionHistory.tsx:78 unreleased group key '__unreleased__' label 'Unreleased' prepended; :222 data-testid `version-group-${g.key}`. e2e: tests/e2e/entity-version-history.test.ts:65 `historyIsReady = versions.length >= 2 && versions.some(v => v.releaseId == null)`; :81 endpointWithHistory and :125 databaseTableWithHistory PATCH a random description until it holds. Precondition :201 `expect(versions.some((v) => v.releaseId == null)).toBe(true)` now holds on a reused env with cut releases: each PATCH is a content change (random suffix, not deduped — versions.ts:230), versions.ts:305 INSERT omits release_id → NULL, list route maps `releaseId: r.release_id` (versions.ts:348) so `== null` matches; release.ts:613/796 stamp only pre-existing NULL rows at cut time. Loop terminates after ≤1 PATCH once ≥2 versions exist. DOM assertions (:214 group count 1, first group `version-group-__unreleased__`, '(unreleased)' count 0) match VersionHistory.tsx. Not run (no app); typecheck green."
    },
    {
      "slug": "goal:u02-host-ui-kit",
      "level": 2,
      "status": "covered",
      "evidence": "DiffView: detail/DiffView.tsx — non-empty hunks in mode, else before/after as two plain-text panes, else EmptyState. EntityVersionHistoryView: detail/EntityVersionHistoryView.tsx — useVersions + useVersionDetail ×2 + lineDiffHunks (no useVersionDiff), VersionHistory timeline grouped by release (VersionHistory.tsx groupByRelease, Unreleased on top), restore via useRestoreVersion().mutate. Toast info kind: overlay-feedback/ToastViewport.tsx ToastKind includes 'info', icon Info, TOAST_DURATION_MS.info=3000, TOAST_COLOR.info='var(--c-muted)' (warning var(--c-yellow), error var(--c-red) per wbs9m5zj); ToastHost consumes TOAST_DURATION_MS. FieldGrid (core/FieldGrid.tsx) and FormShell (overlay/FormShell.tsx) render only `children` (+ error/actions slots). Removals: no release pill in version row (VersionHistory.tsx TimelineRows renders label + changedBy badge only; no '(unreleased)' in host-ui-kit code/tests; e2e assertions flipped to count 0); DocumentBody styles content with `--text-body` only, `lede` dropped from its doc (token bridge at 2.1.26 still lists --text-lede, so tokens.ts unchanged is correct); TagPicker.allTags is inline `{ slug; name; color? }[]` in detail/TagPicker.tsx and src/plugin-types/ui.ts:342, ui-kit-surface.ts Tag doc no longer lists it, tag-type.test.ts:83 asserts `description` is an excess property. Also Dialog backdrop rgba(0,0,0,0.4) (rxqin83v) in overlay/Dialog.tsx:205. All plugin callers pass useTags() items (assignable); typecheck green. Round 2 changed only tests/e2e/entity-version-history.test.ts (precondition helper); no host-ui-kit source changed since dc2d8769."
    }
  ],
  "suite": {
    "command": "npm run typecheck",
    "exitCode": 0,
    "summary": "tsc --noEmit passed for root and all plugin workspaces (last: @inharness-ai/c4s-plugin-skill-author typecheck). Tests not run (env-runner only); read statically: DiffView.render.test.ts, EntityVersionHistoryView.render.test.ts, VersionHistory.test.ts, tests/e2e/entity-version-history.test.ts — none broken by the diff."
  }
}