{
  "role": "verifier",
  "scope": { "kind": "unit", "id": "m05-always-excluded" },
  "release": "2.1.14",
  "rows": [
    {
      "slug": "ac-element-always-excluded-na-karcie-age",
      "type": "ac",
      "level": 2,
      "status": "covered",
      "evidence": "src/client/components/settings/catalog.test.ts:152. For block undefined/true: visibleElements(agent) contains 'always-excluded' and not 'allowed-paths'/'disallowed-paths'; rendered AlwaysExcluded HTML has data-testid=\"always-excluded\", `>${root.dir}</li>` for every SYSTEM_ROOTS root with !agentDirectFs, none for agentDirectFs roots (skills) or user roots, plus 'This cannot be turned off.'. Unchecked: always-excluded shown directly above disallowed-paths. Code: agentSettings.tsx:131-142 'always-excluded' has no `visible`; allowed/disallowed keep `visible: !blockDirectFs`; AlwaysExcluded renders agentDeniedDirs(config.roots) as <li>{d}</li> (root-kinds.ts:352-355 filters agentDirectFs=false), matching the round-2 expected set. Round-1 failure (skills dir expected) resolved."
    },
    {
      "slug": "ac-ekran-m26-directories-blokuje-przycisk",
      "type": "ac",
      "level": 2,
      "status": "covered",
      "evidence": "src/client/components/settings/catalog.test.ts:112 `expect(elements.map((e) => e.id)).toEqual(['roots'])`, `expect(keys).toEqual(['roots'])`, no element with configKey plansDir/briefsDir/patchesDir/entitiesDir/releasesDir. Window change only added verifies: settings-page; test unchanged by the diff."
    },
    {
      "slug": "ac-lista-elementu-roots-na-karcie-direct",
      "type": "ac",
      "level": 2,
      "status": "covered",
      "evidence": "src/client/components/settings/catalog.test.ts:181 renders RootsElement over roots=[pages] in a QueryClientProvider: `expect(html).toContain('data-root-id=\"pages\"')`, for every SYSTEM_ROOTS `not.toContain(data-root-id=\"<id>\")` and `not.toContain(root.dir)`. RootsElement.tsx:151 emits data-root-id per draft root only; '.claude4spec/' appears only in comments (lines 26-27). The e2e twin tests/e2e/settings-directories.test.ts:87 needs a live app (app: none)."
    },
    {
      "slug": "goal:m05-always-excluded",
      "level": 2,
      "status": "covered",
      "evidence": "src/client/chat/settings/agentSettings.tsx:131-142 'always-excluded' without `visible` (renders at every flag value); 'allowed-paths' (:128) and 'disallowed-paths' (:159) hide via `visible: (ctx) => !blockDirectFs(ctx)`. SettingsCardFrame.tsx:98 uses the shared visibleElements() (registry.ts:197). Directories-card criteria kept as regression tests (catalog.test.ts:112, :181)."
    }
  ],
  "suite": {
    "command": "npm run typecheck (tests not run locally per build rules; env-runner only)",
    "exitCode": 0,
    "summary": "typecheck exit 0, 0 `error TS` across all workspaces. Static read of tests touching the diff (catalog.test.ts) finds no broken test; stubs.json empty."
  }
}
