{
 "role": "verifier",
 "scope": {
  "kind": "unit",
  "id": "m28-bramki-git"
 },
 "release": "2.1.14",
 "rows": [
  {
   "slug": "git-status-response",
   "type": "dto",
   "level": 1,
   "status": "covered",
   "evidence": "trace.md -> src/shared/git.ts GitRepoInfo/GitStatusResponse: all 8 fields present, branch: string|null (only the branch description changed at 2.1.14, doc updated); src/server/routes/git.test.ts:187 [entity:git-status-response] asserts key set ['ahead','behind','branch','detected','isDirty','lastFetchedAt','remoteUrl','rootPath'], expect(res.body.branch).toBeNull() on detached HEAD, pushOnPush/commitOnRelease(current) -> null, commitPull -> {status:'skipped'}, named still commits"
  },
  {
   "slug": "ac-commit-release-u-ma-komunikat-name-pu",
   "type": "ac",
   "level": 2,
   "status": "covered",
   "evidence": "src/server/services/git.test.ts:1330 it.each current/named/new: expect(message).toBe('v1\\n\\nfirst cut'); expect(message.startsWith('Release ')).toBe(false); git.ts commitUnlocked computes one message for all modes"
  },
  {
   "slug": "ac-przy-committarget-named-bez-branch-al",
   "type": "ac",
   "level": 2,
   "status": "covered",
   "evidence": "src/server/services/git.test.ts:1348 named{branch:null} and new{template:null} on detached HEAD: toEqual({status:'skipped',message:'detached HEAD'}); git.ts commitOnRelease gates branch only for mode current, fallback -> stageAndCommit returns skipped/detached HEAD"
  },
  {
   "slug": "ac-przy-config-git-enabled-false-commitp",
   "type": "ac",
   "level": 2,
   "status": "covered",
   "evidence": "src/server/services/git.test.ts:1367 expect(result).not.toBeNull(); expect(result).toEqual({ status: 'skipped' }); HEAD unchanged"
  },
  {
   "slug": "ac-przy-detached-head-pushonpush-zwraca",
   "type": "ac",
   "level": 2,
   "status": "covered",
   "evidence": "src/server/services/git.test.ts:1379 expect(await svc.pushOnPush('other')).toBeNull(); remote has no 'other'; git.ts pushOnPush: if (!status.detected || !status.branch) return null"
  },
  {
   "slug": "ac-w-swiezym-repo-bez-commitow-commitonr",
   "type": "ac",
   "level": 2,
   "status": "covered",
   "evidence": "src/server/services/git.test.ts:1400 unborn repo, named: expect(result?.status).toBe('error'); expect(result?.recovery?.kind).toBe('branch-missing'); branch not created"
  },
  {
   "slug": "ac-w-swiezym-repo-bez-commitow-commitonr-2",
   "type": "ac",
   "level": 2,
   "status": "covered",
   "evidence": "src/server/services/git.test.ts:1412 unborn repo, new base:null: status 'error', recovery.kind 'base-missing' (resolveDefaultBranch -> null)"
  },
  {
   "slug": "ac-w-trybie-committarget-named-przy-deta",
   "type": "ac",
   "level": 2,
   "status": "covered",
   "evidence": "src/server/services/git.test.ts:1424 detached HEAD, named: status committed, branch release-target, release-target~1 == old tip, HEAD unchanged and still detached"
  },
  {
   "slug": "ac-commitforrelease-przed-git-add-kan",
   "type": "ac",
   "level": 2,
   "status": "covered",
   "evidence": "src/server/services/git.test.ts:1442 project opened through symlink: status committed, message not /outside repository/, pages/a.md + config.json tracked, ext root (resolves outside repo) not tracked and warned"
  },
  {
   "slug": "ac-commitforrelease-staguje-tez-releasesdir",
   "type": "ac",
   "level": 2,
   "status": "covered",
   "evidence": "src/server/services/git.test.ts:1477 tracked contains '.claude4spec/releases/v1.json', 'pages/a.md', '.claude4spec/config.json'; resolveReleaseCommit(releaseFile) == HEAD"
  },
  {
   "slug": "ac-gdy-docelowy-branch-tryb-named-zniknal",
   "type": "ac",
   "level": 2,
   "status": "test-not-verifying",
   "evidence": "src/server/routes/releases.test.ts:232 asserts only the server half: gitSync.status 'error', recovery.kind 'branch-missing', branch not created, GET /api/releases/v1 200. The criterion's second half 'UI otwiera kind-aware GitErrorRecoveryModal' has no assertion: src/client/ui/modals/GitSyncRecover.render.test.ts tests only the generic error window and kind 'non-fast-forward'; nothing asserts the branch-missing window (KIND_HINT 'The configured target branch no longer exists.' in GitSyncRecover.tsx:24)"
  },
  {
   "slug": "ac-gdy-explicit-committarget-base-tryb-new",
   "type": "ac",
   "level": 2,
   "status": "covered",
   "evidence": "src/server/routes/releases.test.ts:251 res.status 201, gitSync.status 'error', recovery.kind 'base-missing', release/v1 not created, GET /api/releases/v1 200"
  },
  {
   "slug": "ac-gdy-git-add-niczego-nie-wniosl-commi",
   "type": "ac",
   "level": 2,
   "status": "test-not-verifying",
   "evidence": "src/server/services/git.test.ts:1498 asserts expect(result).toEqual({ status: 'nothing-to-commit' }) and HEAD unchanged (server half). The window changed the title to 'bez żadnego sygnału w interfejsie' (was 'bez warningu w toaście'); no test asserts that a gitSync {status:'nothing-to-commit'} produces no toast / no git-sync-recover window in the client (grep 'nothing-to-commit' in src/client: no hits)"
  },
  {
   "slug": "ac-gdy-wyrenderowana-nazwa-nowego-brancha",
   "type": "ac",
   "level": 2,
   "status": "covered",
   "evidence": "src/server/services/git.test.ts:1511 release/v1 and release/v1-2 exist -> result.branch 'release/v1-3', colliding branches untouched"
  },
  {
   "slug": "ac-gitservice-commitpull-latest-commituje",
   "type": "ac",
   "level": 2,
   "status": "covered",
   "evidence": "src/server/services/git.test.ts:1528 message 'Pull to v1'; added contains pages/b.md and entities/tags.json, not outside.txt, no releases/ file; resolveReleaseCommit unchanged; clean -> {status:'nothing-to-commit'}; detached -> skipped; enabled:false -> resolves {status:'skipped'}"
  },
  {
   "slug": "ac-gitservice-push-branch-pushuje-branch",
   "type": "ac",
   "level": 2,
   "status": "covered",
   "evidence": "src/server/routes/release-pushes.test.ts:244 gitSync toMatchObject({status:'pushed',branch:'release-target'}), remote release-target == marker sha, remote main unchanged; fallback (uncommitted release file) -> {status:'pushed',branch:'main'}; release-push.service.ts:177-180 resolveReleaseCommit -> branchContainingCommit -> pushOnPush(branch)"
  },
  {
   "slug": "ac-push-bez-upstream-przy-bledzie-sie",
   "type": "ac",
   "level": 2,
   "status": "covered",
   "evidence": "src/server/routes/release-pushes.test.ts:209 no-upstream / non-fast-forward / remote gone: res.status 201, body.status 'success', gitSync.status 'error', gitSync.message non-empty string; audit log 3 entries all 'success'"
  },
  {
   "slug": "ac-w-trybie-config-git-committarget-mode-n",
   "type": "ac",
   "level": 2,
   "status": "covered",
   "evidence": "src/server/services/git.test.ts:1571 release-target~1 == tipBefore, spec.md in release-target tree; HEAD sha/branch, ls-files --stage, status --porcelain and working file unchanged"
  },
  {
   "slug": "ac-w-trybie-named-new-gdy-tree-po-stage-je",
   "type": "ac",
   "level": 2,
   "status": "covered",
   "evidence": "src/server/services/git.test.ts:1596 named and new: toEqual({ status: 'nothing-to-commit' }), target tip unchanged, release/v1 not created"
  },
  {
   "slug": "ac-w-trybie-new-commitforrelease-tworzy-n",
   "type": "ac",
   "level": 2,
   "status": "covered",
   "evidence": "src/server/services/git.test.ts:1618 explicit base main: branch release/v1, release/v1~1 == mainTip (HEAD on 'work' elsewhere); base:null: auto/v2~1 == mainTip via private resolveDefaultBranch (git.ts:289 'private async resolveDefaultBranch'); HEAD unmoved"
  },
  {
   "slug": "goal:m28-bramki-git",
   "level": 2,
   "status": "covered",
   "evidence": "src/server/services/git.ts: commitOnRelease:919 / pushOnPush:941 gated entries return null (named/new skip the branch gate), commit:443 / push:834 executions; commitPull:799 -> {status:'skipped'} on gate; named/new fresh repo -> branch-missing/base-missing (commitToNamedBranch/commitToNewBranch); message `${name}\\n\\n${description}`:467. Removals: no commitForRelease method anywhere in src (only a stale code comment at src/server/services/git.test.ts:954), no 'Release ' prefix, resolveDefaultBranch is private (git.ts:289)"
  }
 ],
 "suite": {
  "command": "npm run typecheck",
  "exitCode": 0,
  "summary": "tsc -p tsconfig.server/client/types + typecheck:envelopes all passed (exit 0); tests not run per ## This build (env-runner only); no existing test broken by the diff (only docblocks/comments changed in git.ts, src/shared/git.ts)"
 }
}